,id,title,overview,original_language,runtime,origin_country,budget,revenue,release_date,genres,production_companies,revenue_per_budget,yearmonthday,yearmonth,year
379,522478,Peter Rabbit 2: The Runaway,"Peter Rabbit runs away from his human family when he learns they are going to portray him in a bad light in their book. Soon, he crosses paths with an older rabbit who ropes him into a heist.",en,93,US,45000000,153000000,2021-03-25,"Family, Comedy, Adventure, Animation","Columbia Pictures, Olive Bridge Entertainment, Animal Logic, MRC, 2.0 Entertainment",3.4,20210325,202103,2021
379,522478,Peter Rabbit 2: The Runaway,"Peter Rabbit runs away from his human family when he learns they are going to portray him in a bad light in their book. Soon, he crosses paths with an older rabbit who ropes him into a heist.",en,93,AU,45000000,153000000,2021-03-25,"Family, Comedy, Adventure, Animation","Columbia Pictures, Olive Bridge Entertainment, Animal Logic, MRC, 2.0 Entertainment",3.4,20210325,202103,2021
380,611698,A Writer's Odyssey,"Kongwen Lu is the author of a fantasy novel series following a heroic teenager, also named Kongwen, on a quest to end the tyrannical rule of Lord Redmane, under the guidance of a Black Armor. But through a strange twist of fate, the fantasy world of the novel begins to impact life in the real world, leading Guan Ning to accept a mission from Tu Ling to kill the author.",zh,130,CN,0,150123320,2021-02-12,"Fantasy, Action, Adventure, Drama","United Entertainment Partners, 华策影业（上海）有限公司, Free Whale Pictures",,20210212,202102,2021
381,459151,The Boss Baby: Family Business,The Templeton brothers — Tim and his Boss Baby little bro Ted — have become adults and drifted away from each other. But a new boss baby with a cutting-edge approach and a can-do attitude is about to bring them together again … and inspire a new family business.,en,107,US,82000000,146745280,2021-07-01,"Animation, Comedy, Adventure, Family","DreamWorks Animation, Universal Pictures",1.7895765853658536,20210701,202107,2021
382,675445,PAW Patrol: The Movie,Ryder and the pups are called to Adventure City to stop Mayor Humdinger from turning the bustling metropolis into a state of chaos.,en,86,US,26000000,144327371,2021-08-09,"Family, Comedy, Adventure, Animation","Spin Master, Nickelodeon Movies, Paramount Pictures, Mikros Image, Mikros Animation",5.55105273076923,20210809,202108,2021
383,587807,Tom & Jerry,"Tom the cat and Jerry the mouse get kicked out of their home and relocate to a fancy New York hotel, where a scrappy employee named Kayla will lose her job if she can’t evict Jerry before a high-class wedding at the hotel. Her solution? Hiring Tom to get rid of the pesky mouse.",en,101,US,50000000,136536687,2021-02-10,"Comedy, Family, Animation","Warner Animation Group, Turner Entertainment Co., The Story Company, Warner Bros. Pictures",2.73073374,20210210,202102,2021
384,610253,Halloween Kills,"Michael manages to free himself from Laurie Strode's trap to resume his ritual bloodbath. As she fights for her life from injuries from their last encounter, she inspires her daughter Karen, her granddaughter Allyson, and all of Haddonfield to rise up against the unstoppable monster.",en,105,US,20000000,133423964,2021-10-14,"Horror, Thriller","Blumhouse Productions, Miramax, Rough House Pictures, Trancas International Films",6.6711982,20211014,202110,2021
385,895435,Be Somebody,"During the Republican era, a group of frustrated people from the movie industry is invited in a luxurious mansion to make a movie out of a gruesome case that has recently rattled the city of Shanghai, in the hopes that it would turn into a huge sensation and make them famous. However, they never expected that the murderer would be in their midst and that the truth behind the case would be far more bizarre than their fictional movie plot.",zh,123,CN,40000000,132326332,2021-11-11,"Comedy, Mystery, Drama","Shanghai PMF Media, 万合天宜, Maoyan Entertainment",3.3081583,20211111,202111,2021
386,527774,Raya and the Last Dragon,"Long ago, in the fantasy world of Kumandra, humans and dragons lived together in harmony. But when an evil force threatened the land, the dragons sacrificed themselves to save humanity. Now, 500 years later, that same evil has returned and it’s up to a lone warrior, Raya, to track down the legendary last dragon to restore the fractured land and its divided people.",en,107,US,100000000,130423032,2021-03-03,"Animation, Family, Fantasy, Action, Adventure",Walt Disney Animation Studios,1.30423032,20210303,202103,2021
387,476669,The King's Man,"As a collection of history's worst tyrants and criminal masterminds gather to plot a war to wipe out millions, one man must race against time to stop them.",en,131,US,100000000,125897478,2021-12-22,"Action, Adventure, Thriller","Marv, Cloudy Productions, 20th Century Studios",1.25897478,20211222,202112,2021
388,639721,The Addams Family 2,The Addams get tangled up in more wacky adventures and find themselves involved in hilarious run-ins with all sorts of unsuspecting characters.,en,93,US,0,119815153,2021-10-01,"Animation, Family, Comedy, Fantasy, Adventure","Metro-Goldwyn-Mayer, Bron Studios, BermanBraun, Cinesite Animation, Nitrogen Studios Canada",,20211001,202110,2021
389,723640,My Love,"Tells the 15-year love story between Zhou Xiao Qi, a long-time swimming student and You Yong Ci, a transfer student. In high school, Zhou Xiao Qi fell in love at first sight with You Yong Ci. A young and ignorant pure love, the boy silently guarded, but the girl left without saying goodbye. Life after that, 15 years of love long-distance race. Your wedding is also my coming-of-age gift.",zh,115,CN,0,114000000,2021-04-30,"Romance, Drama",Beijing Enlight Pictures,,20210430,202104,2021
390,585245,Clifford the Big Red Dog,"As Emily struggles to fit in at home and at school, she discovers a small red puppy who is destined to become her best friend. When Clifford magically undergoes one heck of a growth spurt, becomes a gigantic dog and attracts the attention of a genetics company, Emily and her Uncle Casey have to fight the forces of greed as they go on the run across New York City. Along the way, Clifford affects the lives of everyone around him and teaches Emily and her uncle the true meaning of acceptance and unconditional love.",en,97,US,64000000,107347356,2021-11-10,"Family, Adventure, Comedy, Fantasy","Paramount Pictures, Entertainment One, New Republic Pictures, Scholastic Entertainment, The Kerner Entertainment Company",1.6773024375,20211110,202111,2021
391,637649,Wrath of Man,"A cold and mysterious new security guard for a Los Angeles cash truck company surprises his co-workers when he unleashes precision skills during a heist. The crew is left wondering who he is and where he came from. Soon, the marksman's ultimate motive becomes clear as he takes dramatic and irrevocable steps to settle a score.",en,119,US,40000000,103966489,2021-04-22,"Thriller, Crime, Drama","Miramax, Toff Guy Films",2.599162225,20210422,202104,2021
392,796039,Boonie Bears: The Wild Life,"Bear brothers Briar and Bramble set off on an adventure with their human friend Vick to Wild Land, an amusement park where humans can turn into animals using a gene-technology bracelet.",zh,99,CN,0,97225611,2021-02-12,"Animation, Comedy, Science Fiction, Adventure",Huaqiang Fangte Animation,,20210212,202102,2021
393,662638,Detective Conan: The Scarlet Bullet,"At the opening ceremony of the WSG (World Sports Games) Tokyo Games, a sports festival held once every four years, it is announced that the world's first vacuum superconducting maglev with a maximum speed of 1,000 kilometers per hour will open. While attracting attention from around the world, top executives of large companies are kidnapped from the party venue where WSG tournament sponsors gather. Conan moves toward a solution and eventually finds a connection with the WSG abduction case that occurred 15 years ago in Boston, USA.",ja,110,JP,0,95371578,2021-04-16,"Animation, Action, Crime, Mystery, Romance, Thriller","TMS Entertainment, Shogakukan, Yomiuri Telecasting Corporation, Nippon Television Network Corporation, Shogakukan-Shueisha Productions, TOHO, Audio Planning U",,20210416,202104,2021
394,283566,Evangelion: 3.0+1.0 Thrice Upon a Time,"In the aftermath of the Fourth Impact, stranded without their Evangelions, Shinji, Asuka and Rei find refuge in one of the rare pockets of humanity that still exist on the ruined planet Earth. There, each lives a life far different from their days as an Evangelion pilot. However, the danger to the world is far from over. A new impact is looming on the horizon—one that will prove to be the true end of Evangelion.",ja,155,JP,29700000,93882453,2021-03-08,"Animation, Action, Science Fiction, Drama",khara,3.1610253535353534,20210308,202103,2021
395,631843,Old,A group of families on a tropical holiday discover that the secluded beach where they are staying is somehow causing them to age rapidly – reducing their entire lives into a single day.,en,108,US,18000000,90146510,2021-07-21,"Thriller, Mystery, Horror","Universal Pictures, Perfect World Pictures, Blinding Edge Pictures",5.008139444444445,20210721,202107,2021
396,795607,Green Snake,"While trying to free her sister from Fahai's clutches, Xiao Qing winds up in a dystopian city and meets a mysterious man who can't recall his past life.",zh,131,CN,0,87212911,2021-07-23,"Animation, Fantasy, Action, Adventure","Light Chaser Animation Studios, Alibaba Pictures Group",,20210723,202107,2021
397,460465,Mortal Kombat,"Washed-up MMA fighter Cole Young, unaware of his heritage, and hunted by Emperor Shang Tsung's best warrior, Sub-Zero, seeks out and trains with Earth's greatest champions as he prepares to stand against the enemies of Outworld in a high stakes battle for the universe.",en,110,AU,20000000,84426031,2021-04-07,"Action, Fantasy, Adventure","Atomic Monster, Broken Road Productions, New Line Cinema",4.22130155,20210407,202104,2021
397,460465,Mortal Kombat,"Washed-up MMA fighter Cole Young, unaware of his heritage, and hunted by Emperor Shang Tsung's best warrior, Sub-Zero, seeks out and trains with Earth's greatest champions as he prepares to stand against the enemies of Outworld in a high stakes battle for the universe.",en,110,CA,20000000,84426031,2021-04-07,"Action, Fantasy, Adventure","Atomic Monster, Broken Road Productions, New Line Cinema",4.22130155,20210407,202104,2021
397,460465,Mortal Kombat,"Washed-up MMA fighter Cole Young, unaware of his heritage, and hunted by Emperor Shang Tsung's best warrior, Sub-Zero, seeks out and trains with Earth's greatest champions as he prepares to stand against the enemies of Outworld in a high stakes battle for the universe.",en,110,US,20000000,84426031,2021-04-07,"Action, Fantasy, Adventure","Atomic Monster, Broken Road Productions, New Line Cinema",4.22130155,20210407,202104,2021
398,565028,Candyman,"A Chicago artist's sanity starts to unravel, unleashing a terrifying wave of violence when he begins to explore the macabre history of the Candyman.",en,91,CA,25000000,77411570,2021-08-25,"Horror, Thriller","Metro-Goldwyn-Mayer, Monkeypaw Productions, Bron Studios, Universal Pictures",3.0964628,20210825,202108,2021
398,565028,Candyman,"A Chicago artist's sanity starts to unravel, unleashing a terrifying wave of violence when he begins to explore the macabre history of the Candyman.",en,91,US,25000000,77411570,2021-08-25,"Horror, Thriller","Metro-Goldwyn-Mayer, Monkeypaw Productions, Bron Studios, Universal Pictures",3.0964628,20210825,202108,2021
399,602223,The Forever Purge,All the rules are broken as a sect of lawless marauders decides that the annual Purge does not stop at daybreak and instead should never end as they chase a group of immigrants who they want to punish because of their harsh historical past.,en,103,US,18000000,76994245,2021-06-30,"Action, Horror, Thriller","Blumhouse Productions, Platinum Dunes, Universal Pictures, Man in a Tree Productions, Perfect World Pictures",4.277458055555556,20210630,202106,2021
400,76600,Avatar: The Way of Water,"Set more than a decade after the events of the first film, learn the story of the Sully family (Jake, Neytiri, and their kids), the trouble that follows them, the lengths they go to keep each other safe, the battles they fight to stay alive, and the tragedies they endure.",en,192,US,350000000,2330224914,2022-12-14,"Action, Adventure, Fantasy, Science Fiction","20th Century Studios, Lightstorm Entertainment",6.657785468571428,20221214,202212,2022
401,361743,Top Gun: Maverick,"After more than thirty years of service as one of the Navy’s top aviators, and dodging the advancement in rank that would ground him, Pete “Maverick” Mitchell finds himself training a detachment of TOP GUN graduates for a specialized mission the likes of which no living pilot has ever seen.",en,131,US,170000000,1488732821,2022-05-21,"Action, Drama","Skydance Media, Don Simpson/Jerry Bruckheimer Films, Paramount Pictures",8.757251888235293,20220521,202205,2022
402,507086,Jurassic World Dominion,"Four years after Isla Nublar was destroyed, dinosaurs now live—and hunt—alongside humans all over the world. This fragile balance will reshape the future and determine, once and for all, whether human beings are to remain the apex predators on a planet they now share with history's most fearsome creatures.",en,147,US,583900000,1004004592,2022-06-01,"Adventure, Action, Science Fiction","Amblin Entertainment, Universal Pictures",1.7194803767768454,20220601,202206,2022
403,453395,Doctor Strange in the Multiverse of Madness,"Doctor Strange, with the help of mystical allies both old and new, traverses the mind-bending and dangerous alternate realities of the Multiverse to confront a mysterious new adversary.",en,126,US,290000000,955775804,2022-05-04,"Fantasy, Action, Adventure","Marvel Studios, Kevin Feige Productions",3.2957786344827587,20220504,202205,2022
404,438148,Minions: The Rise of Gru,"A fanboy of a supervillain supergroup known as the Vicious 6, Gru hatches a plan to become evil enough to join them, with the backup of his followers, the Minions.",en,87,US,85000000,940203765,2022-06-29,"Family, Comedy, Adventure, Animation","Universal Pictures, Illumination",11.061220764705883,20220629,202206,2022
405,505642,Black Panther: Wakanda Forever,"Queen Ramonda, Shuri, M’Baku, Okoye and the Dora Milaje fight to protect their nation from intervening world powers in the wake of King T’Challa’s death.  As the Wakandans strive to embrace their next chapter, the heroes must band together with the help of War Dog Nakia and Everett Ross and forge a new path for the kingdom of Wakanda.",en,162,US,250000000,859102154,2022-11-09,"Action, Adventure, Science Fiction",Marvel Studios,3.436408616,20221109,202211,2022
406,414906,The Batman,"In his second year of fighting crime, Batman uncovers corruption in Gotham City that connects to his own family while facing a serial killer known as the Riddler.",en,177,US,185000000,772319315,2022-03-01,"Crime, Mystery, Thriller","6th & Idaho Motion Picture Company, Dylan Clark Productions, DC Films, Warner Bros. Pictures",4.174699,20220301,202203,2022
407,616037,Thor: Love and Thunder,"After his retirement is interrupted by Gorr the God Butcher, a galactic killer who seeks the extinction of the gods, Thor Odinson enlists the help of King Valkyrie, Korg, and ex-girlfriend Jane Foster, who now wields Mjolnir as the Mighty Thor. Together they embark upon a harrowing cosmic adventure to uncover the mystery of the God Butcher’s vengeance and stop him before it’s too late.",en,119,US,250000000,760900000,2022-07-06,"Fantasy, Action, Comedy","Marvel Studios, Kevin Feige Productions",3.0436,20220706,202207,2022
408,928123,The Battle at Lake Changjin II: Water Gate Bridge,"In the follow-up to ""The Battle At Lake Changjin"", brothers Wu Qianli and Wu Wanli undertake a new task for the People's Volunteer Army, defending a bridge part of the American troops' escape route from the advancing Chinese.",zh,149,CN,200000000,626203271,2022-02-01,"War, History, Action, Drama","Bona Film Group, Distribution Workshop, China Film Group Corporation, Alibaba Pictures Group, Huaxia Film Distribution, Just Creative Studio, Mandrill Visual Effects",3.131016355,20220201,202202,2022
409,315162,Puss in Boots: The Last Wish,"Puss in Boots discovers that his passion for adventure has taken its toll: He has burned through eight of his nine lives, leaving him with only one life left. Puss sets out on an epic journey to find the mythical Last Wish and restore his nine lives.",en,103,US,90000000,484700000,2022-12-07,"Animation, Adventure, Fantasy, Comedy, Family",DreamWorks Animation,5.385555555555555,20221207,202212,2022
410,801803,Moon Man,"Working as a maintenance crew member on the moon, Duguyue is left behind after the evacuation mission forgets about him. A meteorite then destroys planet Earth, leaving him as the only man left alive in existence.",zh,122,CN,0,460300583,2022-07-29,"Science Fiction, Comedy, Drama",Fun Age Pictures,,20220729,202207,2022
411,338953,Fantastic Beasts: The Secrets of Dumbledore,"Professor Albus Dumbledore knows the powerful, dark wizard Gellert Grindelwald is moving to seize control of the wizarding world. Unable to stop him alone, he entrusts magizoologist Newt Scamander to lead an intrepid team of wizards and witches. They soon encounter an array of old and new beasts as they clash with Grindelwald's growing legion of followers.",en,142,US,200000000,407200000,2022-04-06,"Fantasy, Adventure","Warner Bros. Pictures, Heyday Films",2.036,20220406,202204,2022
411,338953,Fantastic Beasts: The Secrets of Dumbledore,"Professor Albus Dumbledore knows the powerful, dark wizard Gellert Grindelwald is moving to seize control of the wizarding world. Unable to stop him alone, he entrusts magizoologist Newt Scamander to lead an intrepid team of wizards and witches. They soon encounter an array of old and new beasts as they clash with Grindelwald's growing legion of followers.",en,142,GB,200000000,407200000,2022-04-06,"Fantasy, Adventure","Warner Bros. Pictures, Heyday Films",2.036,20220406,202204,2022
412,335787,Uncharted,"A young street-smart, Nathan Drake and his wisecracking partner Victor “Sully” Sullivan embark on a dangerous pursuit of “the greatest treasure never found” while also tracking clues that may lead to Nathan’s long-lost brother.",en,116,US,120000000,407141258,2022-02-10,"Action, Adventure","Columbia Pictures, Atlas Entertainment, PlayStation Productions, Arad Productions",3.392843816666667,20220210,202202,2022
413,675353,Sonic the Hedgehog 2,"After settling in Green Hills, Sonic is eager to prove he has what it takes to be a true hero. His test comes when Dr. Robotnik returns, this time with a new partner, Knuckles, in search for an emerald that has the power to destroy civilizations. Sonic teams up with his own sidekick, Tails, and together they embark on a globe-trotting journey to find the emerald before it falls into the wrong hands.",en,123,US,110000000,405421518,2022-03-30,"Action, Adventure, Family, Comedy","Original Film, Blur Studio, Marza Animation Planet, Paramount Pictures, SEGA, SEGA of America",3.6856501636363634,20220330,202203,2022
414,436270,Black Adam,"Nearly 5,000 years after he was bestowed with the almighty powers of the Egyptian gods—and imprisoned just as quickly—Black Adam is freed from his earthly tomb, ready to unleash his unique form of justice on the modern world.",en,125,US,200000000,393452111,2022-10-19,"Action, Adventure, Science Fiction","New Line Cinema, Flynn Picture Company, DC Films, Seven Bucks Productions, Warner Bros. Pictures",1.967260555,20221019,202210,2022
415,923192,Too Cool to Kill,"Wei Chenggong, a working actor with big dreams, finally appears to get his big break when actress Milan invites him to play the lead role of ""Killer Karl"" in a new play. Little does Wei Chenggong know, he has fallen into a perilous conspiracy where all the villains are real, and only through his acting skills and good deal of luck will he be able to make it out alive.",zh,109,CN,0,393014816,2022-02-01,"Action, Comedy","New Classics Media, Slinky Town Pictures, Tianjin Yuewen Media",,20220201,202202,2022
416,916224,Suzume,"Suzume, 17, lost her mother as a little girl. On her way to school, she meets a mysterious young man. But her curiosity unleashes a calamity that endangers the entire population of Japan, and so Suzume embarks on a journey to set things right.",ja,121,JP,0,323638107,2022-11-11,"Animation, Drama, Adventure, Fantasy","CoMix Wave Films, Story, Lawson Entertainment, jeki, voque ting, KADOKAWA, Aniplex, TOHO",,20221111,202211,2022
417,614934,Elvis,"The life story of Elvis Presley as seen through the complicated relationship with his enigmatic manager, Colonel Tom Parker.",en,159,AU,85000000,288670284,2022-06-22,"Drama, Music, History","Warner Bros. Pictures, Bazmark, The Jackal Group",3.3961209882352943,20220622,202206,2022
417,614934,Elvis,"The life story of Elvis Presley as seen through the complicated relationship with his enigmatic manager, Colonel Tom Parker.",en,159,US,85000000,288670284,2022-06-22,"Drama, Music, History","Warner Bros. Pictures, Bazmark, The Jackal Group",3.3961209882352943,20220622,202206,2022
418,783675,The First Slam Dunk,"Shohoku's “speedster” and point guard, Ryota Miyagi, always plays with brains and lightning speed, running circles around his opponents while feigning composure. In his second year of high school, Ryota plays with the Shohoku High School basketball team along with Sakuragi, Rukawa, Akagi, and Mitsui as they take the stage at the Inter-High School National Championship. And now, they are on the brink of challenging the reigning champions, Sannoh Kogyo High School.",ja,125,JP,0,258000000,2022-12-03,"Animation, Comedy, Drama","Toei Animation, Toei Company, DandeLion Animation Studio",,20221203,202212,2022
419,945664,Lighting Up the Stars,"Having been released after serving his sentence, a funeral director accidentally crosses paths with a girl which brings about an unexpected change in his attitude towards life.",zh,112,CN,8800000,253816909,2022-06-24,Drama,"Lian Ray Pictures, Zhejiang Hengdian Film Production, China Film Group Corporation, Tianjin Maoyan Weiying Culture Media, Tao Piao Piao, Weibo Corporation",28.842830568181817,20220624,202206,2022
420,629542,The Bad Guys,"When the Bad Guys, a crew of criminal animals, are finally caught after years of heists and being the world’s most-wanted villains, Mr. Wolf brokers a deal to save them all from prison.",en,100,US,80000000,250162278,2022-03-17,"Family, Comedy, Crime, Adventure, Animation, Action",DreamWorks Animation,3.127028475,20220317,202203,2022
421,718930,Bullet Train,"Unlucky assassin Ladybug is determined to do his job peacefully after one too many gigs gone off the rails. Fate, however, may have other plans, as Ladybug's latest mission puts him on a collision course with lethal adversaries from around the globe—all with connected, yet conflicting, objectives—on the world's fastest train.",en,126,US,90000000,239300000,2022-08-03,"Action, Comedy, Thriller","87North Productions, Columbia Pictures",2.658888888888889,20220803,202208,2022
422,1022145,Home Coming,"Two members of the Chinese Ministry of Foreign Affairs are tasked with the evacuation of Chinese citizens when war breaks out in Numia, North Africa.",zh,137,CN,0,236085820,2022-09-30,"Drama, War",Huace Film & TV,,20220930,202209,2022
423,718789,Lightyear,Legendary Space Ranger Buzz Lightyear embarks on an intergalactic adventure alongside a group of ambitious recruits and his robot companion Sox.,en,105,US,200000000,226425420,2022-06-15,"Animation, Science Fiction, Family, Adventure",Pixar,1.1321271,20220615,202206,2022
424,882598,Smile,"After witnessing a bizarre, traumatic incident involving a patient, Dr. Rose Cotter starts experiencing frightening occurrences that she can't explain.",en,115,US,17000000,217408513,2022-09-23,"Horror, Mystery","Paramount Players, Paramount Pictures, Temple Hill Entertainment",12.78873605882353,20220923,202209,2022
425,803266,Nice View,"20-year-old Jing Hao came to Shenzhen to live with his young sister alone. The siblings live a warm yet straitened life. In an effort to pay for his sister's expensive surgery, Jing Hao gets an opportunity by chance, thinking that a better life is coming, but unexpectedly encounters a serious setback. Under the pressure of both time and money, Jing Hao, who has no way out, decides to take a desperate gamble. Can this ignite the spark of hope for his troubled ordinary life?",zh,106,CN,0,211018982,2022-02-01,"Drama, Family, Comedy","Shenzhen Media Film & Television, Shanghai Tao Piao Piao Movie & TV Culture",,20220201,202202,2022
426,539681,DC League of Super-Pets,"When Superman and the rest of the Justice League are kidnapped, Krypto the Super-Dog must convince a rag-tag shelter pack - Ace the hound, PB the potbellied pig, Merton the turtle and Chip the squirrel - to master their own newfound powers and help him rescue the superheroes.",en,105,US,90000000,203000000,2022-07-27,"Family, Comedy, Adventure, Animation, Science Fiction","Warner Animation Group, DC Entertainment, Seven Bucks Productions, Animal Logic, Warner Bros. Pictures",2.2555555555555555,20220727,202207,2022
