,id,title,overview,original_language,runtime,origin_country,budget,revenue,release_date,genres,production_companies,revenue_per_budget,yearmonthday,yearmonth,year
0,91314,Transformers: Age of Extinction,"As humanity picks up the pieces after the battle of Chicago, a shadowy group reveals itself in an attempt to control the direction of history…while an ancient, powerful new menace sets Earth in its crosshairs. With help from Cade Yeager, Optimus Prime and the Autobots rise to meet their most fearsome challenge yet.",en,165,US,210000000,1104054072,2014-06-25,"Science Fiction, Action, Adventure","di Bonaventura Pictures, DeSanto/Murphy Productions, Ian Bryce Productions, Paramount Pictures, Hasbro",5.257400342857143,20140625,201406,2014
1,122917,The Hobbit: The Battle of the Five Armies,"Following Smaug's attack on Laketown, Bilbo and the dwarves try to defend Erebor's mountain of treasure from others who claim it: the men of the ruined Laketown and the elves of Mirkwood. Meanwhile an army of Orcs led by Azog the Defiler is marching on Erebor, fueled by the rise of the dark lord Sauron. Dwarves, elves and men must unite, and the hope for Middle-Earth falls into Bilbo's hands.",en,144,US,250000000,956019788,2014-12-10,"Action, Adventure, Fantasy","New Line Cinema, Metro-Goldwyn-Mayer, WingNut Films",3.824079152,20141210,201412,2014
2,118340,Guardians of the Galaxy,"Light years from Earth, 26 years after being abducted, Peter Quill finds himself the prime target of a manhunt after discovering an orb wanted by Ronan the Accuser.",en,121,US,170000000,772776600,2014-07-30,"Action, Science Fiction, Adventure",Marvel Studios,4.545744705882353,20140730,201407,2014
3,102651,Maleficent,"A beautiful, pure-hearted young woman, Maleficent has an idyllic life growing up in a peaceable forest kingdom, until one day when an invading army threatens the harmony of the land. She rises to be the land's fiercest protector, but she ultimately suffers a ruthless betrayal – an act that begins to turn her heart into stone. Bent on revenge, Maleficent faces an epic battle with the invading King's successor and, as a result, places a curse upon his newborn infant Aurora. As the child grows, Maleficent realizes that Aurora holds the key to peace in the kingdom – and to Maleficent's true happiness as well.",en,97,US,180000000,758539785,2014-05-28,"Fantasy, Adventure, Action, Family, Romance","Walt Disney Pictures, Roth Films",4.214109916666667,20140528,201405,2014
4,131631,The Hunger Games: Mockingjay - Part 1,"After surviving the Quarter Quell, Katniss finds herself in the hidden stronghold of District 13, where the rebellion against the Capitol is gaining momentum. Struggling with the weight of becoming the symbol of resistance, she must navigate fragile alliances while trying to protect those she loves. As propaganda battles rage and Panem moves closer to full-scale war, Katniss is forced to confront the true cost of revolution.",en,123,US,125000000,755356711,2014-11-19,"Science Fiction, Adventure, Thriller","Lionsgate, Color Force",6.042853688,20141119,201411,2014
5,127585,X-Men: Days of Future Past,The ultimate X-Men ensemble fights a war for the survival of the species across two time periods as they join forces with their younger selves in an epic battle that must change the past – to save our future.,en,132,US,250000000,747862775,2014-05-15,"Action, Adventure, Science Fiction","Bad Hat Harry Productions, The Donners' Company, 20th Century Fox, Marvel Entertainment, TSG Entertainment, Genre Films",2.9914511,20140515,201405,2014
6,157336,Interstellar,The adventures of a group of explorers who make use of a newly discovered wormhole to surpass the limitations on human space travel and conquer the vast distances involved in an interstellar voyage.,en,169,US,165000000,746606706,2014-11-05,"Adventure, Drama, Science Fiction","Legendary Pictures, Syncopy, Lynda Obst Productions",4.524889127272727,20141105,201411,2014
7,100402,Captain America: The Winter Soldier,"After the cataclysmic events in New York with The Avengers, Steve Rogers, aka Captain America is living quietly in Washington, D.C. and trying to adjust to the modern world. But when a S.H.I.E.L.D. colleague comes under attack, Steve becomes embroiled in a web of intrigue that threatens to put the world at risk. Joining forces with the Black Widow, Captain America struggles to expose the ever-widening conspiracy while fighting off professional assassins sent to silence him at every turn. When the full scope of the villainous plot is revealed, Captain America and the Black Widow enlist the help of a new ally, the Falcon. However, they soon find themselves up against an unexpected and formidable enemy—the Winter Soldier.",en,136,US,170000000,714766572,2014-03-20,"Action, Adventure, Science Fiction",Marvel Studios,4.204509247058824,20140320,201403,2014
8,119450,Dawn of the Planet of the Apes,"A group of scientists in San Francisco struggle to stay alive in the aftermath of a plague that is wiping out humanity, while Caesar tries to maintain dominance over his community of intelligent apes.",en,130,US,170000000,710644566,2014-07-08,"Science Fiction, Action, Drama, Thriller","TSG Entertainment, Chernin Entertainment, Ingenious Media, 20th Century Fox",4.180262152941176,20140708,201407,2014
9,102382,The Amazing Spider-Man 2,"For Peter Parker, life is busy. Between taking out the bad guys as Spider-Man and spending time with the person he loves, Gwen Stacy, high school graduation cannot come quickly enough. Peter has not forgotten about the promise he made to Gwen’s father to protect her by staying away, but that is a promise he cannot keep. Things will change for Peter when a new villain, Electro, emerges, an old friend, Harry Osborn, returns, and Peter uncovers new clues about his past.",en,141,US,200000000,708962323,2014-04-16,"Action, Adventure, Science Fiction","Columbia Pictures, Matt Tolmach Productions, Arad Productions, Marvel Entertainment",3.544811615,20140416,201404,2014
10,177572,Big Hero 6,"A special bond develops between plus-sized inflatable robot Baymax, and prodigy Hiro Hamada, who team up with a group of friends to form a band of high-tech heroes.",en,102,US,165000000,657870525,2014-10-24,"Adventure, Family, Animation, Action, Comedy",Walt Disney Animation Studios,3.987094090909091,20141024,201410,2014
11,82702,How to Train Your Dragon 2,"Five years have passed since Hiccup and Toothless united the dragons and Vikings of Berk. Now, they spend their time charting unmapped territories. During one of their adventures, the pair discover a secret cave that houses hundreds of wild dragons -- and a mysterious dragon rider. Hiccup and Toothless find themselves at the center of a battle to protect Berk from a power-hungry warrior.",en,102,US,145000000,621537519,2014-06-05,"Fantasy, Action, Adventure, Animation, Comedy, Family",DreamWorks Animation,4.286465648275862,20140605,201406,2014
12,190859,American Sniper,"U.S. Navy SEAL Chris Kyle takes his sole mission—protect his comrades—to heart and becomes one of the most lethal snipers in American history. His pinpoint accuracy not only saves countless lives but also makes him a prime target of insurgents. Despite grave danger and his struggle to be a good husband and father to his family back in the States, Kyle serves four tours of duty in Iraq. However, when he finally returns home, he finds that he cannot leave the war behind.",en,133,US,58800000,542300000,2014-12-25,"War, Action","Warner Bros. Pictures, Village Roadshow Pictures, RatPac Entertainment, Mad Chance, 22nd & Indiana Pictures, Malpaso Productions",9.22278911564626,20141225,201412,2014
13,124905,Godzilla,"Ford Brody, a Navy bomb expert, has just reunited with his family in San Francisco when he is forced to go to Japan to help his estranged father, Joe. Soon, both men are swept up in an escalating crisis when an ancient alpha predator arises from the sea to combat malevolent adversaries that threaten the survival of humanity. The creatures leave colossal destruction in their wake, as they make their way toward their final battleground: San Francisco.",en,123,US,160000000,524978362,2014-05-14,"Action, Drama, Science Fiction",Legendary Pictures,3.2811147625,20140514,201405,2014
14,172385,Rio 2,"It's a jungle out there for Blu, Jewel and their three kids after they're hurtled from Rio de Janeiro to the wilds of the Amazon. As Blu tries to fit in, he goes beak-to-beak with the vengeful Nigel, and meets the most fearsome adversary of all: his father-in-law.",en,101,US,103000000,498781117,2014-03-19,"Animation, Adventure, Comedy, Family","Blue Sky Studios, 20th Century Fox Animation",4.8425351165048545,20140319,201403,2014
15,98566,Teenage Mutant Ninja Turtles,"When a kingpin threatens New York City, a group of mutated turtle warriors must emerge from the shadows to protect their home.",en,101,US,125000000,485004754,2014-08-07,"Science Fiction, Action, Adventure, Comedy","Nickelodeon Movies, Paramount Pictures, Platinum Dunes, Mirage Studios, Gama Entertainment Partners, Mednick Productions, Heavy Metal",3.880038032,20140807,201408,2014
16,137106,The Lego Movie,"An ordinary Lego mini-figure, mistakenly thought to be the extraordinary MasterBuilder, is recruited to join a quest to stop an evil Lego tyrant from conquering the universe.",en,100,US,60000000,470759687,2014-02-06,"Animation, Family, Adventure, Comedy, Fantasy","Village Roadshow Pictures, RatPac Entertainment, LEGO, Lin Pictures, Vertigo Entertainment, Warner Animation Group, Animal Logic",7.8459947833333334,20140206,201402,2014
17,240832,Lucy,"A woman, accidentally caught in a dark deal, turns the tables on her captors and transforms into a merciless warrior evolved beyond human logic.",en,89,FR,40000000,469058574,2014-07-25,"Action, Science Fiction","EuropaCorp, Canal+, Ciné+, TF1 Films Production",11.72646435,20140725,201407,2014
18,270946,Penguins of Madagascar,"Skipper, Kowalski, Rico and Private join forces with undercover organization The North Wind to stop the villainous Dr. Octavius Brine from destroying the world as we know it.",en,92,US,132000000,373515621,2014-11-22,"Family, Animation, Adventure, Comedy","DreamWorks Animation, Pacific Data Images",2.8296637954545454,20141122,201411,2014
19,210577,Gone Girl,"With his wife's disappearance having become the focus of an intense media circus, a man sees the spotlight turned on him when it's suspected that he may not be innocent.",en,149,US,61000000,370890259,2014-10-01,"Mystery, Thriller, Drama","20th Century Fox, Regency Enterprises",6.080168180327869,20141001,201410,2014
20,137113,Edge of Tomorrow,"Major Bill Cage is an officer who has never seen a day of combat when he is unceremoniously demoted and dropped into combat. Cage is killed within minutes, managing to take an alpha alien down with him. He awakens back at the beginning of the same day and is forced to fight and die again... and again - as physical contact with the alien has thrown him into a time loop.",en,114,US,178000000,370541256,2014-05-27,"Action, Science Fiction","RatPac Entertainment, Village Roadshow Pictures, VIZ Media, 3 Arts Entertainment, Warner Bros. Pictures",2.081692449438202,20140527,201405,2014
21,181533,Night at the Museum: Secret of the Tomb,"When the magic powers of The Tablet of Ahkmenrah begin to die out, Larry Daley spans the globe, uniting favorite and new characters while embarking on an epic quest to save the magic before it is gone forever.",en,98,US,127000000,363204635,2014-12-17,"Adventure, Comedy, Fantasy, Family","Moving Picture Company, 21 Laps Entertainment, 1492 Pictures, TSG Entertainment, 20th Century Fox",2.8598790157480316,20141217,201412,2014
22,86834,Noah,A man who suffers visions of an apocalyptic deluge takes measures to protect his family from the coming flood.,en,138,US,125000000,362600000,2014-03-07,"Drama, Adventure","Paramount Pictures, Regency Enterprises, Protozoa Pictures",2.9008,20140307,201403,2014
23,198663,The Maze Runner,"A teenager with no memory of his past finds himself among a group of boys living in a walled enclosure surrounded by a massive, ever-changing maze. As he struggles to adapt to their rules and society, he begins to uncover clues that may lead to escape and the truth behind their confinement.",en,113,US,34000000,348319861,2014-09-10,"Action, Mystery, Science Fiction, Thriller","Ingenious Media, The Gotham Group, Dayday Films, Temple Hill Entertainment, TSG Entertainment, 20th Century Fox",10.244701794117647,20140910,201409,2014
24,53182,300: Rise of an Empire,"Greek general Themistocles attempts to unite all of Greece by leading the charge that will change the course of the war. Themistocles faces the massive invading Persian forces led by mortal-turned-god, Xerxes and Artemesia, the vengeful commander of the Persian navy.",en,102,US,110000000,337580051,2014-03-05,"Action, Drama, War","Legendary Pictures, Hollywood Gang Productions, Atmosphere Entertainment MM, Nimar Studios, Warner Bros. Pictures, Cruel & Unusual Films",3.0689095545454546,20140305,201403,2014
25,187017,22 Jump Street,"After making their way through high school (twice), big changes are in store for officers Schmidt and Jenko when they go deep undercover at a local college. But when Jenko meets a kindred spirit on the football team, and Schmidt infiltrates the bohemian art major scene, they begin to question their partnership. Now they don't have to just crack the case - they have to figure out if they can have a mature relationship. If these two overgrown adolescents can grow from freshmen into real men, college might be the best thing that ever happened to them.",en,112,US,50000000,331333876,2014-06-05,"Crime, Comedy, Action","Columbia Pictures, Original Film, MRC, Metro-Goldwyn-Mayer, Cannell Studios, JHF Productions, 33andOut Productions",6.62667752,20140605,201406,2014
26,116149,Paddington,"A young Peruvian bear travels to London in search of a home. Finding himself lost and alone at Paddington Station, he meets the kindly Brown family, who offer him a temporary haven.",en,95,GB,55000000,326088587,2014-11-24,"Comedy, Adventure, Family","StudioCanal, Anton Capital Entertainment, Heyday Films, TF1 Films Production, Dimension Films",5.9288834,20141124,201411,2014
27,260346,Taken 3,"Ex-government operative Bryan Mills finds his life is shattered when he's falsely accused of a murder that hits close to home. As he's pursued by a savvy police inspector, Mills employs his particular set of skills to track the real killer and exact his unique brand of justice.",en,109,US,48000000,325800000,2014-12-16,"Thriller, Action","EuropaCorp, 20th Century Fox, M6 Films, TSG Entertainment, Meñakoz Films",6.7875,20141216,201412,2014
28,222935,The Fault in Our Stars,"Despite the tumor-shrinking medical miracle that has bought her a few years, Hazel has never been anything but terminal, her final chapter inscribed upon diagnosis. But when a patient named Augustus Waters suddenly appears at Cancer Kid Support Group, Hazel's story is about to be completely rewritten.",en,126,US,14000000,307166834,2014-05-16,"Romance, Drama","TSG Entertainment, Fox 2000 Pictures, Temple Hill Entertainment",21.94048814285714,20140516,201405,2014
29,157350,Divergent,"In a world divided into factions based on personality types, Tris learns that she's been classified as Divergent and won't fit in. When she discovers a plot to destroy Divergents, Tris and the mysterious Four must find out what makes Divergents dangerous before it's too late.",en,139,US,85000000,288885818,2014-03-14,"Action, Adventure, Science Fiction","Summit Entertainment, Red Wagon Entertainment",3.398656682352941,20140314,201403,2014
30,82703,Mr. Peabody & Sherman,"A young boy and his dog, who happens to have a genius-level IQ, spring into action when their time-machine is stolen and moments in history begin to be changed.",en,92,US,145000000,272912430,2014-02-07,"Animation, Adventure, Family","Pacific Data Images, DreamWorks Animation, Bullwinkle Studios",1.8821546896551724,20140207,201402,2014
31,195589,Neighbors,A couple with a newborn baby face unexpected difficulties after they are forced to live next to a fraternity house.,en,97,US,18000000,270665134,2014-05-08,Comedy,"Good Universe, Universal Pictures, Point Grey Pictures",15.036951888888888,20140508,201405,2014
32,147441,Exodus: Gods and Kings,"The defiant leader Moses rises up against the Egyptian Pharaoh Ramses, setting 400,000 slaves on a monumental journey of escape from Egypt and its terrifying cycle of deadly plagues.",en,150,GB,140000000,268031828,2014-12-03,"Adventure, Drama, Action","20th Century Fox, TSG Entertainment, Chernin Entertainment, Babieka Films, Volcano Films, Scott Free Productions",1.9145130571428572,20141203,201412,2014
32,147441,Exodus: Gods and Kings,"The defiant leader Moses rises up against the Egyptian Pharaoh Ramses, setting 400,000 slaves on a monumental journey of escape from Egypt and its terrifying cycle of deadly plagues.",en,150,US,140000000,268031828,2014-12-03,"Adventure, Drama, Action","20th Century Fox, TSG Entertainment, Chernin Entertainment, Babieka Films, Volcano Films, Scott Free Productions",1.9145130571428572,20141203,201412,2014
33,250546,Annabelle,A couple begins to experience terrifying supernatural occurrences involving a vintage doll shortly after their home is invaded by satanic cultists.,en,99,US,6500000,257589952,2014-10-01,Horror,"Atomic Monster, New Line Cinema, The Safran Company, RatPac Entertainment",39.629223384615386,20141001,201410,2014
34,184315,Hercules,"When a new enemy threatens the innocent, Hercules must lead his fearless team of warriors in a battle against overwhelming odds.",en,98,US,100000000,244819862,2014-07-23,"Action, Adventure","Paramount Pictures, Radical Studios, Flynn Picture Company, Metro-Goldwyn-Mayer",2.44819862,20140723,201407,2014
35,97020,RoboCop,"In RoboCop, the year is 2028 and multinational conglomerate OmniCorp is at the center of robot technology.  Overseas, their drones have been used by the military for years, but have been forbidden for law enforcement in America.  Now OmniCorp wants to bring their controversial technology to the home front, and they see a golden opportunity to do it.  When Alex Murphy – a loving husband, father and good cop doing his best to stem the tide of crime and corruption in Detroit – is critically injured, OmniCorp sees their chance to build a part-man, part-robot police officer.  OmniCorp envisions a RoboCop in every city and even more billions for their shareholders, but they never counted on one thing: there is still a man inside the machine.",en,118,US,120000000,242688965,2014-01-30,"Science Fiction, Action, Crime","Metro-Goldwyn-Mayer, Columbia Pictures, Strike Entertainment",2.0224080416666665,20140130,201401,2014
36,205596,The Imitation Game,"Based on the real life story of legendary cryptanalyst Alan Turing, the film portrays the nail-biting race against time by Turing and his brilliant team of code-breakers at Britain's top-secret Government Code and Cypher School at Bletchley Park, during the darkest days of World War II.",en,113,US,14000000,233555708,2014-11-14,"History, Drama, Thriller, War","Bristol Automotive, Black Bear Pictures, FilmNation Entertainment",16.68255057142857,20141114,201411,2014
37,225574,Non-Stop,"Bill Marks is a Federal Air Marshall for whom every day is the same until this one. On this plane ride, he starts receiving text messages from someone claiming to be on the flight and threatening to kill passengers. In a race against the clock, he must identify and stop the killer to save everyone on board.",en,107,US,50000000,222809600,2014-02-26,"Action, Thriller, Mystery","Silver Pictures, StudioCanal, Anton Capital Entertainment, LOVEFiLM International",4.456192,20140226,201402,2014
38,49017,Dracula Untold,"Vlad Tepes is a great hero, but when he learns the Sultan is preparing for battle and needs to form an army of 1,000 boys, he vows to find a way to protect his family. Vlad turns to dark forces in order to get the power to destroy his enemies and agrees to go from hero to monster as he's turned into the mythological vampire, Dracula.",en,92,US,70000000,217124280,2014-10-01,"Horror, Action, Fantasy","Universal Pictures, Legendary Pictures, Michael De Luca Productions",3.1017754285714285,20141001,201410,2014
39,138103,The Expendables 3,"Barney, Christmas and the rest of the team comes face-to-face with Conrad Stonebanks, who years ago co-founded The Expendables with Barney. Stonebanks subsequently became a ruthless arms trader and someone who Barney was forced to kill… or so he thought. Stonebanks, who eluded death once before, now is making it his mission to end The Expendables -- but Barney has other plans. Barney decides that he has to fight old blood with new blood, and brings in a new era of Expendables team members, recruiting individuals who are younger, faster and more tech-savvy. The latest mission becomes a clash of classic old-school style versus high-tech expertise in the Expendables’ most personal battle yet.",en,126,US,95000000,214657577,2014-08-07,"Action, Adventure, Thriller","Davis Films, Ex3 Productions, Fipex Holding, Lionsgate, Millennium Media, Nu Image Entertainment",2.259553442105263,20140807,201408,2014
40,224141,Into the Woods,"In a woods filled with magic and fairy tale characters, a baker and his wife set out to end the curse put on them by their neighbor, a spiteful witch.",en,125,US,50000000,212902372,2014-12-24,"Fantasy, Comedy","Walt Disney Pictures, Marc Platt Productions, Lucamar Productions",4.25804744,20141224,201412,2014
41,228150,Fury,"April, 1945. As the Allies make their final push in the European Theatre, a battle-hardened army sergeant named Wardaddy commands a Sherman tank and her five-man crew on a deadly mission behind enemy lines. Outnumbered and outgunned, and with a rookie soldier thrust into their platoon, Wardaddy and his men face overwhelming odds in their heroic attempts to strike at the heart of Nazi Germany.",en,135,US,68000000,211817906,2014-10-15,"War, Drama, Action","Columbia Pictures, QED International, LStar Capital, Le Grisbi Productions, Crave Films",3.114969205882353,20141015,201410,2014
42,136797,Need for Speed,"The film revolves around a local street-racer who partners with a rich and arrogant business associate, only to find himself framed by his colleague and sent to prison. After he gets out, he joins a New York-to-Los Angeles race to get revenge. But when the ex-partner learns of the scheme, he puts a massive bounty on the racer's head, forcing him to run a cross-country gauntlet of illegal racers in all manner of supercharged vehicles.",en,131,US,66000000,203277636,2014-03-12,"Action, Crime, Drama, Thriller","DreamWorks Pictures, Reliance Entertainment, Bandito Brothers, Mark Sourian Productions, John Gatins Productions, Touchstone Pictures, Electronic Arts",3.0799641818181818,20140312,201403,2014
43,193610,The Other Woman,"After discovering her boyfriend is married, Carly soon meets the wife he's been cheating on. And when yet another affair is discovered, all three women team up to plot mutual revenge on the three-timing SOB.",en,109,US,40000000,196800000,2014-04-16,"Comedy, Romance","LBI Productions, 20th Century Fox, TSG Entertainment",4.92,20140416,201404,2014
44,156022,The Equalizer,"McCall believes he has put his mysterious past behind him and dedicated himself to beginning a new, quiet life. But when he meets Teri, a young girl under the control of ultra-violent Russian gangsters, he can’t stand idly by – he has to help her. Armed with hidden skills that allow him to serve vengeance against anyone who would brutalize the helpless, McCall comes out of his self-imposed retirement and finds his desire for justice reawakened. If someone has a problem, if the odds are stacked against them, if they have nowhere else to turn, McCall will help. He is The Equalizer.",en,132,US,55000000,192330738,2014-09-24,"Thriller, Action, Crime","Lonetree Entertainment, Columbia Pictures, Village Roadshow Pictures, Escape Artists, LStar Capital, Mace Neufeld Productions",3.496922509090909,20140924,201409,2014
45,284298,Breakup Buddies,"Recently cuckolded and reeling from a messy divorce, a hapless former singer hits the road - and the bar - with his all-too-helpful best bud, in this hilarious romantic comedy.",zh,116,CN,0,189000000,2014-09-26,"Comedy, Romance",Dirty Monkey Productions,,20140926,201409,2014
46,119892,The Monkey King,"Sun Wukong is a monkey born from a heavenly stone who acquires supernatural powers. After rebelling against heaven and being imprisoned under a mountain for 500 years, he later accompanies the monk Xuanzang on a journey to India. Thus, according to legend, Buddhism is brought to ancient China.",zh,119,CN,82000000,182206924,2014-01-09,"Action, Adventure, Family, Fantasy","Filmko Pictures, Mandarin Films, Beijing Wen Hua Dong Run Investment, China Film Group Corporation",2.2220356585365852,20140109,201401,2014
46,119892,The Monkey King,"Sun Wukong is a monkey born from a heavenly stone who acquires supernatural powers. After rebelling against heaven and being imprisoned under a mountain for 500 years, he later accompanies the monk Xuanzang on a journey to India. Thus, according to legend, Buddhism is brought to ancient China.",zh,119,HK,82000000,182206924,2014-01-09,"Action, Adventure, Family, Fantasy","Filmko Pictures, Mandarin Films, Beijing Wen Hua Dong Run Investment, China Film Group Corporation",2.2220356585365852,20140109,201401,2014
47,262391,Serial (Bad) Weddings,A catholic French couple sees their life upside down when their four daughters get married to men of different religion and origins.,fr,94,FR,13000000,176404493,2014-04-16,Comedy,UGC,13.569576384615385,20140416,201404,2014
